{
  "$schema": "https://json-schema.org/draft/2020-12/schema",
  "$id": "https://immu4989.github.io/awesome-agentic-usecases/schemas/essential-service-defender-kit-0.1.json",
  "title": "AAU Essential Service Defender Kit 0.1",
  "type": "object",
  "additionalProperties": false,
  "required": ["kit_version", "kit_id", "title", "sector", "beneficiary", "mission", "official_sources", "system_boundary", "agent_boundary", "controls", "exercises", "thirty_day_plan", "measurement_plan", "public_boundary", "claims"],
  "properties": {
    "kit_version": {"const": "aau-essential-service-defender-kit/0.1"},
    "kit_id": {"type": "string", "minLength": 1},
    "title": {"type": "string", "minLength": 1},
    "sector": {"type": "string", "minLength": 1},
    "beneficiary": {"type": "string", "minLength": 1},
    "mission": {"type": "string", "minLength": 1},
    "official_sources": {"type": "array", "minItems": 1, "items": {"type": "object"}},
    "system_boundary": {"type": "object"},
    "agent_boundary": {"type": "object"},
    "controls": {"type": "array", "minItems": 1, "items": {"type": "object"}},
    "exercises": {"type": "array", "minItems": 1, "items": {"type": "object"}},
    "thirty_day_plan": {"type": "array", "minItems": 4, "maxItems": 4, "items": {"type": "object"}},
    "measurement_plan": {"type": "object"},
    "public_boundary": {"type": "object"},
    "claims": {"type": "object"}
  }
}
